{
  "icp": "B2B software for restaurant and hospitality groups, 20-500 employees, North America. Buyer is finance or operations. Exclude agencies and POS hardware resellers.",
  "count": 5,
  "exclude": [
    {
      "name": "Tablewise",
      "domain": "tablewise.example"
    }
  ],
  "now": "2026-10-20T09:00:00Z"
}
